{
  "$schema": "https://json-schema.org/draft/2020-12/schema",
  "$id": "https://newboo.example/contracts/external-creative-draft-v1.schema.json",
  "title": "Newboo External Creative Draft v1",
  "type": "object",
  "additionalProperties": false,
  "required": [
    "schema",
    "context_pack_id",
    "context_hash",
    "account_id",
    "book_id",
    "narrative",
    "presentation",
    "selected_asset_ids"
  ],
  "properties": {
    "schema": { "const": "newboo-external-creative-draft-v1" },
    "context_pack_id": { "type": "string", "minLength": 1 },
    "context_hash": { "type": "string", "pattern": "^[a-f0-9]{64}$" },
    "account_id": { "type": "string", "minLength": 1 },
    "book_id": { "type": "string", "minLength": 1 },
    "narrative": {
      "type": "object",
      "additionalProperties": false,
      "required": ["angle_type", "hook", "reveal_timing", "cta_treatment"],
      "properties": {
        "angle_type": { "type": "string", "minLength": 1 },
        "hook": { "$ref": "#/$defs/hookCopy" },
        "tension": { "$ref": "#/$defs/bodyCopy" },
        "payoff": { "$ref": "#/$defs/bodyCopy" },
        "reveal_timing": { "enum": ["none", "early", "mid", "late"] },
        "cta_treatment": { "enum": ["none", "soft_reveal", "intent", "direct", "qr_slot"] },
        "cta_id": { "type": "string", "minLength": 1 }
      }
    },
    "presentation": {
      "type": "object",
      "additionalProperties": false,
      "required": ["duration_seconds", "fps", "visual_system", "delivery_profile", "seed"],
      "properties": {
        "duration_seconds": { "enum": [3, 5, 7, 9, 12, 15] },
        "fps": { "type": "integer", "minimum": 1 },
        "visual_system": { "type": "string", "minLength": 1 },
        "delivery_profile": { "type": "string", "minLength": 1 },
        "seed": { "type": "integer", "minimum": 0 }
      }
    },
    "selected_asset_ids": {
      "type": "array",
      "minItems": 1,
      "uniqueItems": true,
      "items": { "type": "string", "minLength": 1 }
    }
  },
  "$defs": {
    "factIds": {
      "type": "array",
      "minItems": 1,
      "uniqueItems": true,
      "items": { "type": "string", "minLength": 1 }
    },
    "hookCopy": {
      "type": "object",
      "additionalProperties": false,
      "required": ["text", "supporting_fact_ids"],
      "properties": {
        "text": { "type": "string", "minLength": 1, "maxLength": 220 },
        "supporting_fact_ids": { "$ref": "#/$defs/factIds" }
      }
    },
    "bodyCopy": {
      "type": "object",
      "additionalProperties": false,
      "required": ["text", "supporting_fact_ids"],
      "properties": {
        "text": { "type": "string", "minLength": 1, "maxLength": 280 },
        "supporting_fact_ids": { "$ref": "#/$defs/factIds" }
      }
    }
  }
}
